{
  "schema_version": "1.3",
  "phase": "spec",
  "feature": "cu-YmMtb3BlbkNhcmQtMgBvcGVuLWNhcmQtZmxvdw",
  "verdict": "PASS",
  "report_validity": "UNVERIFIED",
  "quality_axes": {
    "functional": {
      "applicable": true,
      "required_for_release": true,
      "verdict": "PASS",
      "blocking_class": null,
      "source_checks": [
        "acceptance_content_complete",
        "acceptance_device_focus_present",
        "acceptance_flow_contract",
        "acceptance_flow_structure",
        "acceptance_ut_layer_complete",
        "acceptance_yaml_present",
        "authoritative_content_aligned",
        "capability_spec_codebase",
        "capability_spec_existing_acceptance",
        "capability_spec_requirement",
        "design_scope_facts",
        "legacy_device_testing_todo_deprecated",
        "node_options_injection"
      ],
      "resolution": null
    },
    "visual": {
      "applicable": true,
      "required_for_release": true,
      "verdict": "PASS",
      "blocking_class": null,
      "source_checks": [
        "capability_spec_visual_reference",
        "capture_completeness",
        "capture_completeness_external",
        "fidelity_capability_pregate",
        "fidelity_target_declared",
        "ui_spec_bbox_semantic",
        "ui_spec_fidelity_gate",
        "ui_spec_structure",
        "visual_handoff",
        "visual_handoff_denominator"
      ],
      "resolution": null
    },
    "asset": {
      "applicable": true,
      "required_for_release": true,
      "verdict": "PASS",
      "blocking_class": null,
      "source_checks": [
        "asset_acquisition",
        "asset_manifest"
      ],
      "resolution": null
    },
    "evidence": {
      "applicable": false,
      "required_for_release": false,
      "verdict": "NOT_APPLICABLE",
      "blocking_class": null,
      "source_checks": [],
      "resolution": null
    }
  },
  "release_readiness": "READY",
  "completion_status": "COMPLETE",
  "blocker_count": 0,
  "fail_count": 0,
  "warn_count": 3,
  "gate_fingerprint": "3.1.0:c7aae462a07e",
  "asset_debt_revision": "no-debt",
  "script_report": "doc/features/bc-openCard-2/open-card-flow/spec/reports/script-report.json",
  "merged_report": "doc/features/bc-openCard-2/open-card-flow/spec/reports/merged-report.md",
  "ai_prompt": "doc/features/bc-openCard-2/open-card-flow/spec/reports/ai-prompt.md",
  "summary_json": "doc/features/bc-openCard-2/open-card-flow/spec/reports/summary.json",
  "run_statuses": [],
  "readiness_signals": [],
  "blocking_skips": [],
  "blockers": [],
  "disclosed_failures": [],
  "next_action": "phase_closed_wait_user",
  "closure_status": "closed",
  "assurance": "full",
  "capability_resolutions": [
    {
      "id": "capability_spec_requirement",
      "axis": "functional",
      "active": true,
      "state": "resolved",
      "on_missing": "fail",
      "applicability_provider_id": "applicability.always",
      "applicability_dependencies": [],
      "inputs": [
        {
          "id": "requirement",
          "state": "resolved",
          "selected_source": "derive.requirement",
          "selected_source_fingerprint": "e928a0a262b03ba2a234b2dd522ce4f713be8217455039159d41956be9072ac9",
          "binding": {
            "input_id": "requirement",
            "source": {
              "kind": "derive",
              "provider_id": "derive.requirement"
            },
            "dependencies": [
              {
                "path": "D:\\1.code\\SimulatedWalletForHmos\\doc\\features\\原始需求\\1-2-银行卡\\原始需求.md",
                "exists": true,
                "sha256": "2a6bbd10d4ff297ad9b23670ba0e302f5feef7cc0757e43dd7b04ae909052300",
                "role": "derive"
              }
            ],
            "source_refs": [
              "doc/features/原始需求/1-2-银行卡/原始需求.md"
            ],
            "content_fingerprint": "e928a0a262b03ba2a234b2dd522ce4f713be8217455039159d41956be9072ac9"
          },
          "attempts": [
            {
              "kind": "derive",
              "source": "derive.requirement",
              "state": "resolved",
              "dependencies": [
                {
                  "path": "D:\\1.code\\SimulatedWalletForHmos\\doc\\features\\原始需求\\1-2-银行卡\\原始需求.md",
                  "exists": true,
                  "sha256": "2a6bbd10d4ff297ad9b23670ba0e302f5feef7cc0757e43dd7b04ae909052300",
                  "role": "derive"
                }
              ]
            }
          ]
        }
      ]
    },
    {
      "id": "capability_spec_codebase",
      "axis": "functional",
      "active": true,
      "state": "resolved",
      "on_missing": "prune",
      "applicability_provider_id": "applicability.always",
      "applicability_dependencies": [],
      "inputs": [
        {
          "id": "codebase",
          "state": "resolved",
          "selected_source": "derive.codebase",
          "selected_source_fingerprint": "6c7c033175833dfcf68d2d22fb2cb8f8d4ededb396a52a4b3ffcfe0f534acf93",
          "binding": {
            "input_id": "codebase",
            "source": {
              "kind": "derive",
              "provider_id": "derive.codebase"
            },
            "dependencies": [
              {
                "path": "D:\\1.code\\SimulatedWalletForHmos\\01-Product\\Phone\\src\\main\\ets\\pages\\index.ets",
                "exists": true,
                "sha256": "21b852d52466892915b81dbf64e79429c9de1074e8f50a3b3e504d04d9e2dba0",
                "role": "derive"
              },
              {
                "path": "D:\\1.code\\SimulatedWalletForHmos\\02-Feature\\WalletMain\\src\\main\\ets\\data\\model\\BankInfo.ets",
                "exists": true,
                "sha256": "0415c01bfcae5b62cce9f754965729515a5d6ea9f675ff1730bdeddc45376222",
                "role": "derive"
              },
              {
                "path": "D:\\1.code\\SimulatedWalletForHmos\\02-Feature\\WalletMain\\src\\main\\ets\\data\\repository\\BankRepository.ets",
                "exists": true,
                "sha256": "b5e92f1a6f3b4256747f9ae6d38face63a1420bf64616f14d3751c473f5f6ade",
                "role": "derive"
              },
              {
                "path": "D:\\1.code\\SimulatedWalletForHmos\\02-Feature\\WalletMain\\src\\main\\ets\\index.ets",
                "exists": true,
                "sha256": "8091328f669e0b71340b6b141a47ded704f62a31647ad7bab0ea60752f9338c4",
                "role": "derive"
              },
              {
                "path": "D:\\1.code\\SimulatedWalletForHmos\\02-Feature\\WalletMain\\src\\main\\ets\\presentation\\pages\\AddBankCardPage.ets",
                "exists": true,
                "sha256": "5f636c6081094d08660774afa9ecdccabbcb7cb751ecfd474b540877cc08e754",
                "role": "derive"
              },
              {
                "path": "D:\\1.code\\SimulatedWalletForHmos\\02-Feature\\WalletMain\\src\\main\\ets\\presentation\\pages\\AllBanksPage.ets",
                "exists": true,
                "sha256": "0c7ee06f6bf8e8a23fc0de0b566a4014b36f3816ab97cbeee2eb10031b7411c4",
                "role": "derive"
              },
              {
                "path": "D:\\1.code\\SimulatedWalletForHmos\\02-Feature\\WalletMain\\src\\main\\ets\\presentation\\pages\\HomeTabPage.ets",
                "exists": true,
                "sha256": "492ba2d6abcdfb25a43b032c3113b2a21ecbd25649a6e8cb3c295b8c1a82b6b8",
                "role": "derive"
              },
              {
                "path": "D:\\1.code\\SimulatedWalletForHmos\\02-Feature\\WalletMain\\src\\main\\ets\\shared\\constant\\BankConstants.ets",
                "exists": true,
                "sha256": "f250072a31b64dcdb787da259c07651ba53b0067badf7031b1d650d370d81084",
                "role": "derive"
              },
              {
                "path": "D:\\1.code\\SimulatedWalletForHmos\\02-Feature\\WalletMain\\src\\main\\resources\\base\\element\\color.json",
                "exists": true,
                "sha256": "bc4e0d84fc66221345980f0e8f8fe8c7de42c21274e5a8431582e8b13a613164",
                "role": "derive"
              },
              {
                "path": "D:\\1.code\\SimulatedWalletForHmos\\02-Feature\\WalletMain\\src\\main\\resources\\base\\element\\float.json",
                "exists": true,
                "sha256": "691295c683cf1d199c7e0cf0ef04f9e0cc61005c6fb742202ace6cb488fd74fd",
                "role": "derive"
              },
              {
                "path": "D:\\1.code\\SimulatedWalletForHmos\\02-Feature\\WalletMain\\src\\main\\resources\\base\\element\\string.json",
                "exists": true,
                "sha256": "c3214a4e51402470f60adee645398dfc203926e0d042ec2d79d697175328c422",
                "role": "derive"
              },
              {
                "path": "D:\\1.code\\SimulatedWalletForHmos\\04-BusinessBase\\AccountManager\\src\\main\\ets\\data\\model\\UserProfile.ets",
                "exists": true,
                "sha256": "1c81bfc6faa5cb81bc7bce2155e81db84be7bacae59dabcbda81e4aadb7ca366",
                "role": "derive"
              },
              {
                "path": "D:\\1.code\\SimulatedWalletForHmos\\04-BusinessBase\\AccountManager\\src\\main\\ets\\domain\\service\\AccountService.ets",
                "exists": true,
                "sha256": "3af42a0b6baa6895bb91a6d66817c9546db2ef605d1b7e96a861d9c349c3be2b",
                "role": "derive"
              },
              {
                "path": "D:\\1.code\\SimulatedWalletForHmos\\04-BusinessBase\\AccountManager\\src\\main\\ets\\index.ets",
                "exists": true,
                "sha256": "4f41856f439aeb2b26f8e748ad39992dbc1dbb049608c503e7867804a4e95662",
                "role": "derive"
              }
            ],
            "source_refs": [
              "01-Product/Phone/src/main/ets/pages/index.ets",
              "02-Feature/WalletMain/src/main/ets/data/model/BankInfo.ets",